{
  "schema_version": "fault-case.v1",
  "case_id": "fc-go6-furnacehead-leak-001",
  "title": "ON(H)836 炉头漏气 / 动力气压力报警 — 密封圈与排尘堵塞",
  "status": "verified",
  "instrument": {
    "model": "ONH836",
    "instrument_id": "GO6",
    "lab_id": "lab-2lg",
    "location": "二炼钢"
  },
  "symptoms": [
    "炉头漏气，检漏不能稳定加压",
    "动力气压力报警（尤其炉头清扫/动作时）",
    "下氧枪快速接头大漏或燃烧管密封圈微漏"
  ],
  "symptom_tags": ["炉头漏气", "动力气压力", "氧氮氢", "排尘堵塞"],
  "diagnostics": [
    {
      "step": 1,
      "check": "炉头检漏流程：观察燃烧管上下密封圈与快速接头",
      "expected": "检漏可加压且泄漏率正常",
      "if_abnormal": "更换老化密封圈，紧固快速接头"
    },
    {
      "step": 2,
      "check": "炉头动作时监测 PT2 下游压力与排尘管路",
      "expected": "无持续 PT 报警，排尘通畅",
      "if_abnormal": "疏通排尘金属弯管；检查清扫气缸是否漏气"
    },
    {
      "step": 3,
      "check": "解体下氧枪，检查管内坩埚碎片或异物",
      "expected": "气路无堵塞",
      "if_abnormal": "冲洗疏通；维护时避免异物掉入下氧枪"
    }
  ],
  "root_cause": "氧枪密封圈老化破损、燃烧管密封不良，或排尘管路/炉头弯管堵塞导致压力异常。",
  "resolution": {
    "actions": [
      "更换氧枪密封圈与破损密封件",
      "疏通冲洗排尘管与炉头金属弯管",
      "炉头清扫气缸漏气时整体维护或更换套件"
    ],
    "parts": ["氧枪密封圈", "燃烧管密封圈", "排尘管路相关密封件"]
  },
  "prevention": "炉头维护后做检漏确认；排尘堵塞反复出现时安排弯管段彻底解体维护。",
  "evidence": {
    "sources": [
      {
        "kind": "anomaly_calendar",
        "ref": "weekly_report_gas_pre2019.json / 2017-W27",
        "date": "2017-07-08"
      },
      {
        "kind": "anomaly_calendar",
        "ref": "wps_rili_chemical_gas_events_2025-2026.json",
        "date": "2025-01-03"
      }
    ],
    "manual_refs": [
      {
        "manual_id": "ON836_Instruction_Manual_v3.3_2024-06",
        "chapter": "Maintenance",
        "section": "Furnace head / leak check"
      }
    ]
  },
  "metadata": {
    "created_at": "2026-08-30T10:00:00+08:00",
    "verified_by": "knowledge-curator",
    "verified_at": "2026-08-30T10:00:00+08:00",
    "tier": "P0"
  }
}
